{
  "siteId": "a1b2c3d4-1234-4a5b-9c8d-1e2f3a4b5c6d",
  "batteryUnits": [
    {
      "assetId": "11111111-1111-4111-8111-111111111111",
      "measurements": [
        {
          "timestamp": "2026-08-03T09:00:00+02:00",
          "power": -1200.0,
          "chargePower": 0.0,
          "dischargePower": 1200.0,
          "chargeEnergy": 4.8,
          "dischargeEnergy": 2.1,
          "temperature": 27.5,
          "voltage": 401.2,
          "current": 3.0
        }
      ]
    }
  ],
  "photoVoltaicUnits": [
    {
      "assetId": "22222222-2222-4222-8222-222222222222",
      "measurements": [
        {
          "timestamp": "2026-08-03T09:00:00+02:00",
          "dcPower": 6.4,
          "dcVoltage": 380.5,
          "dcCurrent": 16.8,
          "mppEnergy": 1.6,
          "mppPower": 6.2,
          "energyYield": 24.3
        }
      ]
    }
  ],
  "hydroGeneratingUnits": [],
  "evChargers": [
    {
      "assetId": "33333333-3333-4333-8333-333333333333",
      "measurements": [
        {
          "timestamp": "2026-08-03T09:00:00+02:00",
          "power": 7400.0,
          "importEnergy": 3200.0,
          "exportEnergy": 0.0
        }
      ]
    }
  ],
  "heatPumps": [
    {
      "assetId": "44444444-4444-4444-8444-444444444444",
      "measurements": [
        {
          "timestamp": "2026-08-03T09:00:00+02:00",
          "power": 2100.0,
          "supplyTemperature": 45.2,
          "returnTemperature": 38.7,
          "cumulativeEnergyConsumed": 15400.0
        }
      ]
    }
  ],
  "electricBoilers": [
    {
      "assetId": "55555555-5555-4555-8555-555555555555",
      "measurements": [
        {
          "timestamp": "2026-08-03T09:00:00+02:00",
          "power": 800.0,
          "dhwTemperature": 52.0,
          "cumulativeEnergyConsumed": 9800.0
        }
      ]
    }
  ]
}
